[{"id":"math-vector-dot-product","category":"math","difficulty":"foundation","term":"Vector · Matrix · Dot Product","prompt":"벡터와 행렬은 무엇이고, 내적은 AI에서 왜 자주 쓰이나요?","shortAnswer":"벡터는 방향과 크기를 가진 값의 배열이고 행렬은 벡터를 모은 2차원 배열입니다. 내적은 두 벡터의 대응 원소를 곱해 더한 값으로, 방향의 정렬 정도나 선형 변환 결과를 계산할 때 쓰입니다.","deepAnswer":"신경망의 한 뉴런은 입력 벡터와 가중치 벡터의 내적에 bias를 더하는 것으로 볼 수 있습니다. 임베딩 검색에서는 내적 또는 이를 크기로 정규화한 cosine similarity로 벡터가 얼마나 비슷한 방향을 가리키는지 비교합니다.","keyPoints":["뉴런의 선형 결합은 입력과 가중치의 내적","cosine similarity는 크기보다 방향을 비교"],"followUp":"내적이 0이라는 것은 기하학적으로 무엇을 뜻하나요?","prerequisites":[]},{"id":"math-gradient-partial-derivative","category":"math","difficulty":"intermediate","term":"Partial Derivative · Gradient","prompt":"편미분과 gradient의 차이를 신경망 학습과 연결해 설명해보세요.","shortAnswer":"편미분은 여러 변수 중 하나만 변화시켰을 때 함수가 얼마나 변하는지 나타냅니다. Gradient는 모든 변수에 대한 편미분을 모은 벡터이며 함수값이 가장 빠르게 증가하는 방향을 가리킵니다.","deepAnswer":"Loss를 각 weight로 편미분하면 해당 weight가 loss에 미치는 민감도를 얻습니다. 학습은 loss를 줄이기 위해 gradient의 반대 방향으로 파라미터를 이동합니다. 기울기의 크기는 변화율이지 곧바로 최적의 이동량은 아니므로 learning rate가 필요합니다.","keyPoints":["편미분은 한 변수의 변화율","Gradient descent는 gradient의 반대 방향으로 이동"],"followUp":"Gradient가 0이면 항상 최솟값에 도달한 것인가요?","prerequisites":["math-vector-dot-product"]},{"id":"math-chain-rule","category":"math","difficulty":"intermediate","term":"Chain Rule","prompt":"Chain Rule이 없다면 왜 깊은 신경망을 학습시키기 어려울까요?","shortAnswer":"Chain Rule은 합성함수의 미분을 각 단계의 국소 미분 곱으로 분해합니다. 덕분에 출력의 loss가 앞쪽 각 파라미터에 미친 영향을 층을 거슬러 계산할 수 있습니다.","deepAnswer":"Backpropagation은 계산 그래프의 뒤에서부터 local gradient를 재사용하며 Chain Rule을 효율적으로 적용하는 알고리즘입니다. 긴 경로에서 작은 미분값이 계속 곱해지면 vanishing gradient, 큰 값이 곱해지면 exploding gradient가 생길 수 있습니다.","keyPoints":["합성함수 미분을 국소 미분의 곱으로 분해","Backpropagation은 Chain Rule의 효율적 구현"],"followUp":"Vanishing gradient는 어떤 구조나 activation에서 더 쉽게 생기나요?","prerequisites":["math-gradient-partial-derivative"]},{"id":"ml-ai-ml-dl","category":"ml","difficulty":"foundation","term":"AI · ML · DL","prompt":"AI, Machine Learning, Deep Learning의 포함 관계를 예시와 함께 말해보세요.","shortAnswer":"AI는 지능적 행동을 수행하는 시스템 전체를 뜻하고, ML은 데이터를 통해 규칙을 학습하는 AI 방법입니다. DL은 여러 층의 neural network로 표현을 학습하는 ML의 한 분야입니다.","deepAnswer":"규칙 기반 전문가 시스템은 AI이지만 반드시 ML은 아닙니다. 선형회귀나 decision tree는 ML이지만 DL은 아닙니다. Transformer 기반 LLM은 여러 층의 neural network를 학습하므로 DL에 속합니다.","keyPoints":["AI ⊃ ML ⊃ DL","포함 관계는 구현 방식과 학습 방법의 범위를 나타냄"],"followUp":"규칙 기반 시스템과 ML 시스템을 함께 쓰는 사례는 무엇이 있을까요?","prerequisites":[]},{"id":"ml-ai-to-llm-hierarchy","category":"ml","difficulty":"foundation","term":"AI → LLM Hierarchy","prompt":"AI부터 RAG·Agent까지 어떤 포함 관계로 이어지는지 설명해보세요.","shortAnswer":"AI 안에 ML이, ML 안에 DL이 있습니다. DL의 한 architecture가 Transformer이고 이를 대규모로 학습한 것이 LLM이며, RAG와 Agent는 그 LLM을 쓰는 시스템입니다.","deepAnswer":"각 단계는 앞 단계를 대체하는 것이 아니라 좁혀 들어가는 관계입니다. 규칙 기반 전문가 시스템은 AI지만 ML이 아니고, 선형회귀는 ML이지만 DL이 아니며, CNN은 DL이지만 Transformer가 아닙니다. RAG와 Agent는 모델 구조가 아니라 모델을 어떻게 쓰는지에 대한 설계라 같은 LLM 위에 둘 다 올릴 수 있습니다. 이 구분이 흐려지면 학습 대상과 시스템 설계를 섞어 말하게 됩니다.","keyPoints":["AI ⊃ ML ⊃ DL ⊃ Transformer 기반 LLM","RAG와 Agent는 구조가 아니라 LLM을 쓰는 설계"],"followUp":"Transformer이지만 LLM이라고 부르지 않는 예를 들어보세요.","prerequisites":["ml-ai-ml-dl"]},{"id":"ml-supervised-unsupervised","category":"ml","difficulty":"foundation","term":"Supervised · Unsupervised Learning","prompt":"Supervised와 Unsupervised Learning은 학습 신호가 어떻게 다른가요?","shortAnswer":"Supervised Learning은 입력과 정답 label의 쌍으로 예측 오차를 줄입니다. Unsupervised Learning은 명시적 정답 없이 데이터의 구조, 군집, 표현을 찾습니다.","deepAnswer":"분류와 회귀는 대표적인 supervised task이고 clustering이나 dimensionality reduction은 대표적인 unsupervised task입니다. 실제 시스템에서는 self-supervised pretraining처럼 데이터 자체에서 label 역할을 만들어 대규모 표현을 학습하기도 합니다.","keyPoints":["차이는 정답 신호의 존재 방식","Self-supervised는 데이터에서 학습 목표를 구성"],"followUp":"LLM의 next-token pretraining은 왜 self-supervised라고 부르나요?","prerequisites":["ml-ai-ml-dl"]},{"id":"ml-feature-label-prediction","category":"ml","difficulty":"foundation","term":"Feature · Label · Prediction","prompt":"Feature, Label, Prediction을 집값 예측 예시로 구분해보세요.","shortAnswer":"Feature X는 모델에 넣는 평수, 방 개수, 위치 같은 입력 특성입니다. Label y는 학습 데이터에 있는 실제 집값이고, Prediction ŷ는 모델이 계산한 집값입니다.","deepAnswer":"지도학습은 feature에서 prediction을 만든 뒤 label과 비교해 loss를 계산합니다. 학습 데이터의 label은 정답 신호로 쓰이지만 실제 추론 시점에는 알 수 없으므로, 모델은 새 feature만으로 prediction을 만들어야 합니다.","keyPoints":["X는 입력 feature, y는 실제 label","ŷ는 모델의 prediction이며 y와의 차이로 loss 계산"],"followUp":"추론 시점에도 label이 필요하다면 어떤 data leakage를 의심해야 하나요?","prerequisites":["ml-supervised-unsupervised"]},{"id":"ml-self-supervised-signal","category":"ml","difficulty":"intermediate","term":"Self-Supervised Learning","prompt":"Self-Supervised Learning은 Unsupervised Learning과 무엇이 다르고 왜 유용한가요?","shortAnswer":"사람이 붙인 label 없이 데이터 일부를 가리거나 다음 부분을 맞히게 해서 정답 역할의 학습 신호를 데이터 자체에서 만듭니다. 대규모 원시 데이터로 일반적인 표현을 pretraining할 수 있습니다.","deepAnswer":"명시적 사람이 만든 label은 없지만 입력과 target을 구성해 supervised loss 형태로 학습한다는 점이 단순 clustering 같은 unsupervised task와 다릅니다. BERT의 masked token 예측과 GPT의 next-token prediction이 대표적이며, 특정 task에는 이후 supervised fine-tuning이 필요할 수 있습니다.","keyPoints":["정답 신호를 데이터 자체에서 구성","Pretraining과 task-specific supervised learning은 역할이 다름"],"followUp":"Self-supervised pretraining이 특정 task의 높은 성능을 자동으로 보장하지 않는 이유는 무엇인가요?","prerequisites":["ml-supervised-unsupervised","ml-feature-label-prediction"]},{"id":"ml-train-validation-test","category":"ml","difficulty":"foundation","term":"Train · Validation · Test","prompt":"데이터를 Train, Validation, Test로 나누는 이유는 무엇인가요?","shortAnswer":"Train set은 파라미터 학습에, Validation set은 hyperparameter와 모델 선택에, Test set은 최종 일반화 성능 추정에 씁니다. Test를 반복 의사결정에 쓰면 성능 추정이 낙관적으로 편향됩니다.","deepAnswer":"Test set을 반복해서 들여다보면 사실상 또 하나의 validation 데이터가 되어 버립니다. 세 집합은 같은 실제 분포를 대표해야 하며 중복 사용자나 시간 누수처럼 정보가 섞이지 않게 분리해야 합니다. 시계열이나 사용자 데이터는 무작위 행 분할보다 시간 또는 사용자 단위 분할이 더 적절할 수 있습니다.","keyPoints":["Test set은 마지막 독립 평가용","Data leakage가 있으면 지표를 신뢰할 수 없음"],"followUp":"같은 사용자의 데이터가 train과 test에 섞이면 어떤 문제가 생기나요?","prerequisites":["ml-supervised-unsupervised"]},{"id":"ml-parameter-hyperparameter","category":"ml","difficulty":"foundation","term":"Parameter · Hyperparameter","prompt":"Parameter와 Hyperparameter는 누가, 언제 정하는 값인가요?","shortAnswer":"Parameter는 weight와 bias처럼 train data와 loss를 통해 모델이 학습하는 값입니다. Hyperparameter는 learning rate나 모델 깊이처럼 학습 전에 사람이 정하거나 탐색하는 값입니다.","deepAnswer":"batch size나 구조 설계처럼 학습 방식을 정하는 값도 hyperparameter입니다. Validation 결과로 hyperparameter와 모델을 선택하고, test set은 그 선택이 끝난 뒤 최종 평가에 남겨둡니다. 자동 탐색 도구가 hyperparameter를 고르더라도 일반적인 단일 training run의 gradient로 직접 갱신되는 model parameter와 역할은 구분됩니다.","keyPoints":["Parameter는 training objective로 학습","Hyperparameter 선택에는 validation 결과 사용"],"followUp":"Test 성능을 보며 learning rate를 고르면 왜 test leakage가 되나요?","prerequisites":["ml-train-validation-test"]},{"id":"ml-regression-classification","category":"ml","difficulty":"foundation","term":"Regression · Classification","prompt":"Regression과 Classification은 출력과 loss 관점에서 어떻게 다른가요?","shortAnswer":"Regression은 가격처럼 연속값을, Classification은 클래스나 클래스 확률을 예측합니다. 보통 regression에는 MSE, classification에는 cross entropy를 쓰지만 문제의 가정에 따라 달라집니다.","deepAnswer":"MSE는 큰 오차를 제곱으로 더 크게 벌주며 Gaussian noise 가정과 연결됩니다. Cross entropy는 정답 분포와 예측 확률 분포의 차이를 줄이고, softmax와 함께 다중 클래스 확률을 학습할 때 자주 사용합니다.","keyPoints":["출력 공간이 연속값인지 범주인지 구분","Loss는 문제와 데이터 분포의 가정을 반영"],"followUp":"Binary classification에서 sigmoid와 softmax 중 무엇을 쓸 수 있나요?","prerequisites":["ml-supervised-unsupervised"]},{"id":"ml-loss-vs-metric","category":"ml","difficulty":"intermediate","term":"Loss Function · Evaluation Metric","prompt":"학습에 Loss Function이 필요한 이유와 Evaluation Metric과의 차이를 설명해보세요.","shortAnswer":"Loss는 오차를 하나의 값으로 만들어 gradient를 통해 parameter update 방향을 제공합니다. Metric은 accuracy나 F1처럼 사람이 성능을 해석하려고 보는 값이라 미분 가능할 필요가 없습니다.","deepAnswer":"Regression에는 MSE, classification에는 cross entropy가 자주 쓰이지만 문제 가정과 목표에 따라 선택해야 합니다. Accuracy는 예측 class가 바뀌기 전까지 값이 일정해 gradient 정보를 주기 어려우므로 보통 직접 loss로 쓰지 않습니다. 따라서 training loss가 낮아져도 실제 metric이나 비즈니스 결과가 항상 좋아지는 것은 아닙니다.","keyPoints":["Loss는 최적화를 위한 미분 가능한 신호","Metric은 해석과 비교를 위한 최종 평가 기준"],"followUp":"Class imbalance가 심할 때 accuracy만 보면 어떤 문제가 생기나요?","prerequisites":["ml-feature-label-prediction","ml-regression-classification"]},{"id":"ml-overfitting-bias-variance","category":"ml","difficulty":"intermediate","term":"Overfitting · Bias · Variance","prompt":"Overfitting을 Bias-Variance 관점에서 설명하고 대응 방법을 말해보세요.","shortAnswer":"Overfitting은 train 데이터에는 잘 맞지만 새 데이터에 일반화하지 못하는 상태로 높은 variance와 연결됩니다. 더 많은 데이터, regularization, early stopping, 적절한 모델 크기로 줄입니다.","deepAnswer":"Augmentation도 대표 데이터를 늘리는 수단으로 함께 쓰입니다. 높은 bias는 모델이 너무 단순하거나 학습이 부족해 train과 validation 모두 성능이 낮은 underfitting으로 나타납니다. 높은 variance는 train 성능은 좋지만 validation 성능이 나쁜 간격으로 관찰됩니다. 원인을 구분하지 않고 모델을 키우거나 줄이면 반대 문제가 커질 수 있습니다. 다만 매우 큰 신경망에서는 test 오차가 다시 내려가는 double descent처럼 고전적 U-곡선이 그대로 맞지 않는 경우도 보고됩니다.","keyPoints":["Train-validation gap으로 진단","Regularization은 표현력과 일반화의 trade-off를 조절"],"followUp":"Dropout과 weight decay는 각각 어떤 방식으로 regularization하나요?","prerequisites":["ml-train-validation-test"]},{"id":"dl-perceptron-neural-network","category":"dl","difficulty":"foundation","term":"Perceptron · Neural Network","prompt":"Perceptron 하나와 여러 층의 neural network는 표현력에서 무엇이 다른가요?","shortAnswer":"Perceptron은 입력의 가중합에 activation을 적용하는 단순한 계산 단위입니다. 여러 층을 쌓고 비선형 activation을 넣으면 단일 선형 경계로 풀 수 없는 복잡한 함수를 표현할 수 있습니다.","deepAnswer":"층을 여러 개 쌓아도 activation이 모두 선형이면 전체는 하나의 선형 변환으로 합쳐집니다. 따라서 깊이의 표현력을 얻으려면 ReLU 같은 비선형성이 필요합니다. XOR은 단층 선형 분류기의 한계를 보여주는 고전적 예입니다.","keyPoints":["뉴런은 weighted sum + activation","비선형 activation이 깊은 층의 표현력을 만듦"],"followUp":"선형 activation만 여러 층 쌓으면 왜 한 층과 같아지나요?","prerequisites":["math-vector-dot-product","ml-ai-ml-dl"]},{"id":"dl-weight-bias-activation","category":"dl","difficulty":"foundation","term":"Weight · Bias · Activation","prompt":"Weight, Bias, Activation Function의 역할을 각각 설명해보세요.","shortAnswer":"Weight는 입력 특징의 영향력과 변환 방향을 학습하고, bias는 결정 경계를 원점에서 이동시킵니다. Activation은 선형 변환에 비선형성을 더해 복잡한 패턴을 표현하게 합니다.","deepAnswer":"ReLU는 양수 구간의 gradient를 유지해 깊은 신경망에서 널리 쓰입니다. Sigmoid는 값을 0과 1 사이로 만들지만 큰 절댓값에서 gradient가 작아질 수 있습니다. 출력층 activation은 회귀, 이진 분류, 다중 분류 등 task에 맞춰 선택합니다.","keyPoints":["